question,answer
Pergunta: Como o turismo impacta a vida dos Karajá em Aruanã?,"Resposta: O turismo trouxe benefícios como acesso a serviços, mas também aumentou problemas como drogadição, alcoolismo e violência, além de comprometer o Cerrado e a biodiversidade local."
Pergunta: Como os Karajá buscam preservar sua cultura?,"Resposta: Eles buscam preservar sua cultura através de ações como o ensino bilíngue, a valorização dos conhecimentos tradicionais, a promoção da cultura indígena em eventos e oficinas, e o manejo comunitário dos recursos naturais."
Pergunta: O que evidencia a importância do povo Carajá na cidade de Aruanã?,"Resposta: A importância é evidenciada pela própria origem do nome da cidade, derivado de uma dança típica da etnia, e pela presença da aldeia Carajá como um reduto cultural na região."
Pergunta: Como o crescimento urbano afetou os territórios tradicionais dos Karajá em Aruanã?,Resposta: O crescimento urbano sobre os territórios tradicionais resultou no cerceamento do entorno das Terras Indígenas por fazendas de gado e intensificou o desmatamento da região.
Pergunta: Como o comércio de artesanato contribui para a subsistência dos Karajá em Aruanã?,"Resposta: O comércio de artesanato proporciona renda para as famílias Karajá, ajudando na sua sobrevivência."
Pergunta: Como os Karajá buscam preservar sua cultura diante dos impactos do turismo?,"Resposta: Eles buscam preservar sua cultura através de ações como o ensino bilíngue, a valorização dos conhecimentos tradicionais, a realização de eventos e oficinas de promoção da cultura indígena, e o manejo comunitário dos recursos naturais."
Pergunta: Como o desmatamento afeta a dieta alimentar dos Karajá em Aruanã?,"Resposta: O desmatamento reduz a disponibilidade de alimentos tradicionais, como peixes e tartarugas, impactando diretamente a dieta alimentar dos Karajá."
Pergunta: Quais são os principais impactos do turismo na vida dos Karajá em Aruanã?,"Resposta: O turismo trouxe benefícios como acesso a serviços, mas também problemas como drogadição, alcoolismo e violência, além da redução na disponibilidade de recursos naturais."
Pergunta: Quais são as principais atividades tradicionais dos Karajá em Aruanã?,"Resposta: As principais atividades incluem caça, pesca, coleta, plantio e produção de artesanato."
Pergunta: Quais são os principais problemas enfrentados pelos Karajá devido ao turismo?,"Resposta: Alguns problemas incluem a mercantilização da cultura, a deterioração do meio ambiente, o aumento da drogadição e do alcoolismo, e a precarização da saúde indígena."
Pergunta: Qual é o papel do ensino bilíngue na preservação da cultura dos Karajá em Aruanã?,Resposta: O ensino bilíngue mantém viva a língua Carajá e transmite conhecimentos tradicionais aos mais jovens.
Pergunta: Onde os Karajá vivem?,"Resposta: Os Karajá vivem na aldeia de Aruanã, localizada próxima ao Rio Araguaia, no estado de Goiás, Brasil."
Pergunta: Qual é a importância do Rio Araguaia para os Karajá?,"Resposta: O Rio Araguaia é fundamental para os Karajá, pois é onde está localizada a aldeia de Aruanã, onde vivem e realizam atividades tradicionais como pesca e transporte."
Pergunta: Quais são os principais impactos do turismo na vida dos Karajá?,"Resposta: Os principais impactos do turismo na vida dos Karajá incluem ressignificações socioculturais, como mudanças na língua, vestuário, dieta e práticas tradicionais, além de problemas como drogadição, alcoolismo e violência."
Pergunta: Como os Karajá tentam preservar a essência de seu povo?,"Resposta: Os Karajá tentam preservar a essência de seu povo por meio de atividades como artesanato, grafismo e cerâmica, que retratam a realidade do passado e mantêm viva sua cultura tradicional."
Pergunta: Como os Karajá lidam com as dificuldades enfrentadas para manter suas tradições?,"Resposta: Os Karajá buscam enfrentar as dificuldades mantendo suas tradições por meio do comércio de artesanato, ensino bilíngue, preservação da língua e realização de atividades culturais."
"Pergunta: O que significa a palavra ""Carajá"" e qual é a sua importância?","Resposta: A palavra ""Carajá"" vem do Tupi e significa ""macaco grande"". Ela é o nome do povo indígena Karajá, que possui grande importância histórica e cultural na região do Rio Araguaia."
Pergunta: Quais são os principais desafios enfrentados pelos Karajá em Aruanã?,"Resposta: Os principais desafios enfrentados pelos Karajá em Aruanã incluem o cerceamento do entorno das Terras Indígenas, o crescimento urbano sobre seus territórios, o desmatamento, a redução da disponibilidade de alimentos como peixes e tartarugas, além dos impactos sociais do turismo."
Pergunta: Qual é a importância da influência dos Karajá na cidade de Aruanã?,"Resposta: A influência dos Karajá na cidade de Aruanã é significativa, refletindo-se até mesmo no próprio nome da cidade, que vem de uma dança típica da etnia. Além disso, eles contribuem para a diversidade cultural e econômica da região."
"Clara: Olá, Pedro! Você viu aquela reportagem sobre os Karajá em Aruanã?","Pedro: Oi, Clara! Vi sim, achei muito interessante. Eles enfrentam tantos desafios, não é?"
"Pedro: Nossa, são muitos desafios mesmo. Mas como eles conseguem preservar sua cultura diante de tudo isso?","Clara: Eles tentam preservar sua cultura de várias maneiras, como através do comércio de artesanato, o ensino bilíngue (português e Carajá) e a valorização de práticas tradicionais, como danças e produção de grafismos e cerâmicas."
Pedro: E quais são as formas de trabalho mais comuns entre os Karajá em Aruanã?,"Clara: As formas de trabalho mais comuns entre eles incluem a produção de artesanato, como grafismo e cerâmica, além da pesca, caça e cultivo de roças. Eles também realizam atividades relacionadas à cultura, como danças típicas."
"Clara: Sabia que o nome ""Karajá"" vem do Tupi e significa ""macaco grande""?",Pedro: Não fazia ideia! Eles têm algum costume ou tradição que seja especialmente marcante?
"Clara: O turismo trouxe renda para os Karajá através do comércio de artesanato, mas também causou problemas como a drogadição, alcoolismo e aumento do volume de resíduos sólidos.","Pedro: E quanto à alimentação, o que os Karajá consomem principalmente?"
"Clara: Eles contam com lideranças locais e buscam apoio de órgãos governamentais para preservar suas terras e tradições, além de promover ações de educação indígena e manejo comunitário dos recursos naturais.",Pedro: É impressionante como eles conseguem resistir e se adaptar diante de tantos obstáculos.
"Pedro: Não, não estava ciente disso. Quais são essas dificuldades?","Clara: Bem, eles enfrentam problemas como o cerceamento de suas terras por fazendas de gado, o crescimento da cidade de Aruanã sobre seus territórios tradicionais e o intenso desmatamento na região."
"Clara: Uma das formas que encontraram foi através do comércio de artesanato, o que não só ajuda na sustentação das famílias, mas também na revitalização de sua cultura.","Pedro: E o turismo, como tem afetado suas vidas?"
"Clara: O turismo trouxe benefícios como acesso a serviços básicos, mas também trouxe problemas como drogadição, alcoolismo e aumento da violência, além de comprometer o meio ambiente.",Pedro: Eles têm alguma reivindicação específica para lidar com esses impactos?
"Clara: Sim, eles pedem apoio para o manejo comunitário dos recursos naturais, educação indígena, preservação da cultura e uma fiscalização ambiental mais ativa.",Pedro: Entendi. Parece que estão lutando para manter sua identidade cultural e preservar seu modo de vida.
"Clara: Exatamente, Pedro. É uma batalha constante, mas eles demonstram uma grande determinação em preservar suas tradições.",Clara: Você já ouviu falar dos Karajá?
"Pedro: Não, nunca ouvi falar. Quem são eles?","Clara: Os Karajá são um povo indígena que vive na região do Araguaia, especificamente na cidade de Aruanã, em Goiás."
Pedro: Interessante. E como é a vida deles?,"Clara: Eles enfrentam muitas dificuldades para manter suas tradições de caça, pesca e plantio devido ao cerceamento de suas terras, ao desmatamento e ao crescimento da cidade sobre seus territórios."
Pergunta: Qual é a função das bonecas cerâmicas produzidas pelo grupo indígena Karajá?,"Resposta: Além de serem consideradas brinquedos, as bonecas cerâmicas têm uma função pedagógica, transmitindo elementos do mundo natural e sobrenatural para as crianças Karajá."
Pergunta: Por que as bonecas cerâmicas Karajá estão associadas à transmissão de conhecimento e cultura?,"Resposta: No contexto da cultura Karajá, as bonecas cerâmicas não apenas entretêm as crianças, mas também ensinam, preparando-as para a transição do mundo infantil para o mundo adulto, transmitindo aspectos do mundo natural e do sobrenatural."
Pergunta: Quais são algumas das formas de registro da diversidade das culturas indígenas brasileiras ao longo da história?,"Resposta: As formas de registro incluem relatos de viagens, pinturas, ilustrações, expedições científicas e, mais recentemente, o desenvolvimento da técnica fotográfica, que ampliou consideravelmente a quantidade de imagens da diversidade brasileira."
Pergunta: Como as culturas indígenas brasileiras foram representadas nos museus europeus ao longo da história?,"Resposta: As culturas indígenas brasileiras foram representadas nos museus europeus através da coleção de plantas, insetos, animais taxidermizados e de uma grande quantidade de artefatos confeccionados pelos índios do Brasil, que eram expostos como coleções exóticas."
Pergunta: Como a produção cerâmica das bonecas Karajá pode ser relacionada à sua organização social e mítica?,"Resposta: A produção cerâmica das bonecas Karajá pode ser relacionada à organização social e mítica do grupo através da análise das formas, dos motivos gráficos, da pintura corporal, dos ornamentos, e outros elementos que transmitem informações relativas a um sistema de significação social e mítica."
Pergunta: Quais são os principais desafios enfrentados pelos Karajá devido ao contato com a sociedade nacional?,"Resposta: Tuberculose, alcoolismo, subnutrição e discriminação aumentada."
Pergunta: Qual é a divisão de papéis entre homens e mulheres na sociedade Karajá?,"Resposta: Homens: defesa do território, pescarias, construções, atividades políticas e rituais. Mulheres: educação dos filhos, afazeres domésticos, confecção de artefatos, preparo de alimentos e memória afetiva da aldeia."
Pergunta: Quais são as principais atividades de subsistência dos Karajá?,"Resposta: Alimentação à base de ictiofauna do rio Araguaia e lagos, caça de mamíferos e aves para enfeites plumários, roças nas matas-galeria para cultivo de milho, mandioca, entre outros."
Pergunta: Qual é o papel dos mitos e rituais na cultura Karajá?,"Resposta: Os mitos abordam temas variados e estão associados aos rituais, como origem, casamento, poder político, doenças, entre outros."
Pergunta: Quais foram as influências externas mais significativas na cultura dos Karajá ao longo do tempo?,"Resposta: Contato com diversas frentes religiosas, planos governamentais, visitas de presidentes, construção de hotel de turismo, visitas de pesquisadores, escritores e jornalistas, entre outros."
Pergunta: Quais são os principais motivos de cerimônias rituais entre os Karajá?,"Resposta: Iniciação masculina, festa de Aruanã, festa do mel, festa do peixe, entre outros."
Pergunta: Como é realizado o enterro entre os Karajá?,"Resposta: O morto é colocado com seus pertences numa esteira no fundo de uma vala, coberto por varas e lembrando uma casa. Antigamente, faziam o enterro secundário, exumando os ossos e colocando em uma vasilha de cerâmica."
Pergunta: Quem são alguns dos principais estudiosos e pesquisadores que contribuíram para o conhecimento sobre os Karajá?,"Resposta: Paul Ehrenreich, Fritz Krause, William Lipkind, Maria Heloísa Costa Fénelon, Edna Luiza Taveira de Melo, entre outros."
Pergunta: Quais são as atividades de subsistência tradicionais dos Karajá?,"Resposta: Incluem a pesca na ictiofauna do rio Araguaia e lagos, agricultura de subsistência nas matas-galeria, além da coleta de frutos do cerrado e captura de aves para enfeites plumários."
Pergunta: Como é realizada a distribuição de poder político e tomada de decisões nas aldeias Karajá?,"Resposta: O poder de decisão é exercido por membros masculinos das famílias extensas, discutindo suas posições na Casa de Aruanã. Um ""capitão"" da aldeia é eleito para lidar com assuntos políticos externos."
Pergunta: Qual é o mito de origem dos Karajá?,"Resposta: O mito narra a história de como eles saíram do fundo do rio Araguaia para viver na superfície, após um jovem descobrir uma passagem para a terra firme."
Pergunta: Quais são os principais rituais dos Karajá?,"Resposta: Os rituais de iniciação masculina (Hetohoky) e a Festa de Aruanã são os mais importantes, acompanhados por outros menores como a pescaria coletiva de timbó e a festa do mel."
Pergunta: Quais são as principais fontes de informações sobre os Karajá?,"Resposta: As principais fontes incluem relatos de expedicionários, etnografias de antropólogos, registros de jornalistas e viajantes, além de estudos acadêmicos e relatórios governamentais."
Pergunta: Como os Karajá lidam com a divisão de gênero em sua sociedade?,"Resposta: Eles estabelecem claramente papéis sociais para homens e mulheres, atribuindo aos homens atividades como defesa do território e rituais políticos, enquanto as mulheres são responsáveis pela vida doméstica e preservação da cultura material."
Pergunta: Como são realizados os rituais de iniciação masculina entre os Karajá?,"Resposta: Os rituais de iniciação masculina envolvem a perfuração do lábio inferior, pintura corporal, confinamento em uma casa ritual por sete dias, corte de cabelo e realização de cerimônias específicas."
Pergunta: Quais são as duas aldeias onde os Karajá do Norte estão divididos?,"Resposta: As duas aldeias são Xambioá e Kurehe, localizadas na margem direita do rio Araguaia."
Pergunta: Qual é a língua falada pelos Karajá do Norte e a que tronco linguístico pertence?,"Resposta: Eles falam o xambioá, um dialeto específico da língua Karajá, que pertence ao tronco Macro-Jê."
Pergunta: Qual é a população atual dos Karajá do Norte e qual tem sido sua tendência demográfica recente?,"Resposta: Em 2006, os Karajá do Norte somavam 269 pessoas, indicando uma tendência de recuperação numérica após um período de declínio populacional."
